{
  "result_schema_id": "urn:gdo:phase1-post-activation-result:1.0.0",
  "result_contract_id": "GDO_PHASE1_POST_ACTIVATION_RESULT",
  "result_contract_version": "1.0.0",
  "result_id": "gdo-post-activation:1b969efed1fbf315a4c8ba6bd2fee8ac9b1fe99f01418d67c6adc4486e2e731f",
  "registry_id": "GHOST-DEVELOPMENT-ORCHESTRATOR-PROVISIONAL",
  "registry_record_digest": "sha256:1322cc66a59306cbbc6f483a62aac2f718fee64d3abf446bd14f1b25524d5027",
  "gds_docs_head": "aa8d795d5fe7d3fa21c367ef194c346712831423",
  "gdo_head": "b207fc9e1c56ca019d99384173e672f065c7557e",
  "runtime_provider_revision": "sha256:13f6bfe4de941b793e7928ed8a685a319b355c00b7bac6d32989c29d11761ca6",
  "registry_validation": "PASS",
  "gdo_lookup_validation": "PASS",
  "runtime_compatibility": "PASS",
  "strict_verification": "PASS",
  "smoke_validation": "PASS",
  "authority_boundary": "PASS",
  "warning_preservation": "PASS",
  "reversibility": "PASS",
  "phase1_scope": "PHASE1_BOUNDED_LOCAL_ORCHESTRATION",
  "overall_result": "PASS_WITH_WARNING",
  "execution_authority": false,
  "registry_mutation_executed": false,
  "result_digest": "sha256:032981e480a69574469817fcf85ac76d543b9faf7e9e11515078c05684a09191"
}
